{
  "schema_version": 1,
  "project_slug": "attention-sink-llama-long-ctx",
  "created_at": "2026-05-08T09:00:00Z",
  "updated_at": "2026-05-09T11:00:00Z",
  "current_phase": 2,
  "last_gate_passed": "G1",
  "focus_area": "attention",
  "paper_format": "latex-neurips",
  "time_budget_days": 21,
  "compute_budget_gpu_h": 200,
  "adopted_idea_id": null,
  "active_run_ids": [],
  "completed_at": null,
  "rollbacks": []
}
