{
  "schema_version": 1,
  "project_slug": "icl-induction-heads",
  "created_at": "2026-05-04T12:00:00Z",
  "updated_at": "2026-05-09T15:30:00Z",
  "current_phase": 5,
  "last_gate_passed": "G3",
  "focus_area": "attention",
  "paper_format": "markdown",
  "time_budget_days": 10,
  "compute_budget_gpu_h": 60,
  "adopted_idea_id": 1,
  "active_run_ids": [],
  "completed_at": null,
  "rollbacks": [
    {
      "from_phase": 6,
      "to_phase": 5,
      "reason": "sanity failure: MMLU baseline 0.42 vs expected 0.55±0.02",
      "ts": "2026-05-09T15:30:00Z"
    }
  ]
}
