{
  "schema_version": 1,
  "project_slug": "mmlu-prompt-eval-2026",
  "created_at": "2026-05-01T08:00:00Z",
  "updated_at": "2026-05-09T14:00:00Z",
  "current_phase": 4,
  "last_gate_passed": "G3",
  "focus_area": "evaluation",
  "paper_format": "latex-acl",
  "time_budget_days": 14,
  "compute_budget_gpu_h": 80,
  "adopted_idea_id": 2,
  "active_run_ids": [],
  "completed_at": null,
  "rollbacks": []
}
