{
  "schema_version": 1,
  "project_slug": "fresh-project-2026-q2",
  "created_at": "2026-05-09T10:00:00Z",
  "updated_at": "2026-05-09T10:00:00Z",
  "current_phase": 1,
  "last_gate_passed": "G0",
  "focus_area": null,
  "paper_format": null,
  "time_budget_days": null,
  "compute_budget_gpu_h": null,
  "adopted_idea_id": null,
  "active_run_ids": [],
  "completed_at": null,
  "rollbacks": []
}
